{
  "adr_id": "adr0010",
  "authority_boundaries": [
    {
      "description": "Rig core must not depend on any specific forge",
      "id": "forge-neutral-core",
      "must_not": [
        "import forge-specific modules in core",
        "assume GitHub-only features",
        "require remote connectivity"
      ]
    },
    {
      "description": "Forge adapters must not leak provider-specific behavior into core",
      "id": "adapter-isolation",
      "must_not": [
        "modify core workflow based on adapter mode",
        "return forge-specific errors from core",
        "use forge APIs in core validation"
      ]
    },
    {
      "description": "Local-only mode must always work without any forge",
      "id": "local-first",
      "must_not": [
        "require forge API for promotion",
        "fail if remote unavailable",
        "assume remote branches exist"
      ]
    },
    {
      "description": "Tests must not depend on forge availability",
      "id": "test-isolation",
      "must_not": [
        "use real forge APIs in tests",
        "require network for tests",
        "test forge-specific behavior in core tests"
      ]
    },
    {
      "description": "Git is the canonical substrate",
      "id": "git-substrate",
      "must_not": [
        "replace git operations with forge APIs",
        "use forge APIs for local checks",
        "bypass git for remote operations"
      ]
    }
  ],
  "created_at": "2025-05-09T00:00:00Z",
  "files_involved": {
    "modified": [
      "scripts/work_promote.py",
      "docs/adr/README.md",
      ".gitignore"
    ],
    "mission_7": [
      "src/rig/domain/forge.py",
      "src/rig/commands_forge.py",
      "tests/test_repository_forge.py"
    ],
    "mission_8": [
      "src/rig/domain/forge.py",
      "src/rig/commands_forge.py",
      "tests/test_repository_forge.py",
      "docs/adr/0010-repository-forge-bootstrap-and-promotion-abstraction.md",
      "docs/adr/0010-repository-forge-bootstrap-and-promotion-abstraction.json"
    ],
    "mission_9": [
      "src/rig/domain/forge.py",
      "src/rig/commands_forge.py",
      "tests/test_repository_forge.py",
      "docs/adr/0010-repository-forge-bootstrap-and-promotion-abstraction.md",
      "docs/adr/0010-repository-forge-bootstrap-and-promotion-abstraction.json"
    ],
    "sprint_1": [
      "src/rig/domain/forge/__init__.py",
      "src/rig/domain/forge/local_adapter.py",
      "src/rig/domain/forge/registry.py"
    ],
    "sprint_2": [
      "scripts/repo_bootstrap.py",
      ".rig/config/forge.yaml"
    ],
    "sprint_3": [
      "src/rig/domain/forge/github_adapter.py"
    ],
    "sprint_4": [
      "src/rig/domain/forge/gitlab_adapter.py"
    ],
    "sprint_5": [
      "src/rig/domain/forge/gitea_adapter.py"
    ],
    "sprint_6": [
      "docs/workflow/adr-sprint-mission-evidence.md",
      "docs/forge/github.md",
      "docs/forge/gitlab.md",
      "docs/forge/gitea.md"
    ]
  },
  "markdown_path": "docs/adr/0010-repository-forge-bootstrap-and-promotion-abstraction.md",
  "non_goals": [
    "Rig becomes a CI/CD system",
    "Rig supports fork-based workflows",
    "Rig supports multiple forges simultaneously",
    "Rig makes assumptions about branch naming",
    "Rig manages forge credentials",
    "Rig implements two-phase commit"
  ],
  "number": "0010",
  "related_adrs": [
    {
      "id": "adr0007",
      "path": "docs/adr/0007-workspace-domain-authority.md",
      "relationship": "depends_on"
    },
    {
      "id": "adr0009",
      "path": "docs/adr/0009-agentic-workflow-refinement.md",
      "relationship": "depends_on"
    }
  ],
  "reviewability_budget": {
    "applies_to": [
      "local_only",
      "github",
      "gitlab",
      "gitea",
      "future_adapter"
    ],
    "default_action": "block_promotion",
    "max_changed_files": 300,
    "override_allowed": true,
    "override_requires_reason": true,
    "rationale": "Keeps promotion candidates small enough for human and hosted AI review tools."
  },
  "schema_version": "rig.adr.v1",
  "slug": "repository-forge-bootstrap-and-promotion-abstraction",
  "sprints": [
    {
      "id": "sprint-adapter-interface",
      "research_required": true,
      "title": "Adapter Interface Definition"
    },
    {
      "id": "sprint-repo-bootstrap",
      "research_required": true,
      "title": "Repository Bootstrap"
    },
    {
      "id": "sprint-github-adapter",
      "research_required": true,
      "title": "GitHub Adapter"
    },
    {
      "id": "sprint-gitlab-adapter",
      "research_required": true,
      "title": "GitLab Adapter"
    },
    {
      "id": "sprint-gitea-adapter",
      "research_required": true,
      "title": "Gitea Adapter"
    },
    {
      "id": "sprint-documentation",
      "research_required": false,
      "title": "Documentation and Polish"
    },
    {
      "id": "mission-7",
      "research_required": false,
      "title": "GitHub Draft PR Apply"
    },
    {
      "id": "mission-8",
      "research_required": false,
      "title": "GitHub Apply Safety Doctor"
    },
    {
      "id": "mission-9",
      "research_required": false,
      "title": "GitHub Adapter Backend Boundary"
    }
  ],
  "status": "proposed",
  "title": "Repository Forge Bootstrap and Promotion Abstraction",
  "updated_at": "2025-05-10T00:00:00Z",
  "validation_gates": [
    {
      "blocking": true,
      "description": "Sprint research completed",
      "id": "gate-1"
    },
    {
      "blocking": true,
      "description": "Mission handoff completed",
      "id": "gate-2"
    },
    {
      "blocking": true,
      "description": "Patch batches prechecked",
      "id": "gate-3"
    },
    {
      "blocking": false,
      "description": "Patch batches applied and validated",
      "id": "gate-4"
    },
    {
      "blocking": true,
      "description": "Merge-friendliness pass completed",
      "id": "gate-5"
    },
    {
      "blocking": true,
      "description": "work_doctor.py passed",
      "id": "gate-6"
    },
    {
      "blocking": true,
      "description": "Required tests passed",
      "id": "gate-7"
    },
    {
      "blocking": true,
      "description": "Out-of-scope findings recorded",
      "id": "gate-8"
    },
    {
      "blocking": true,
      "description": "Candidate source branch is clean",
      "id": "gate-9"
    },
    {
      "blocking": true,
      "description": "Candidate source branch HEAD is recorded",
      "id": "gate-10"
    },
    {
      "blocking": true,
      "description": "Preproduction branch exists locally",
      "id": "gate-11"
    },
    {
      "blocking": true,
      "description": "Merge simulation against preproduction passes",
      "id": "gate-12"
    },
    {
      "blocking": true,
      "description": "Preproduction working tree is clean before merge",
      "id": "gate-13"
    },
    {
      "blocking": false,
      "description": "GitHub Actions checks passing (optional, forge-specific)",
      "id": "gate-14-github"
    },
    {
      "blocking": false,
      "description": "GitLab CI/CD pipeline passing (optional, forge-specific)",
      "id": "gate-14-gitlab"
    },
    {
      "blocking": false,
      "description": "Gitea Actions checks passing (optional, forge-specific)",
      "id": "gate-14-gitea"
    },
    {
      "blocking": false,
      "description": "Required reviews approved (optional, forge-specific)",
      "id": "gate-15"
    },
    {
      "blocking": false,
      "description": "Branch protection allows merge (optional, forge-specific)",
      "id": "gate-16"
    }
  ],
  "workflow": {
    "ledger_path": ".rig/work/adr/adr0010-repository-forge-bootstrap-and-promotion-abstraction",
    "mission_branch_prefix": "agent/adr0010-",
    "promotion_branch": "promotion/adr0010-repository-forge-bootstrap-and-promotion-abstraction",
    "sprint_branch": "sprint/adr0010-repository-forge-bootstrap-and-promotion-abstraction",
    "worktree_name": "adr0010-repository-forge-bootstrap-and-promotion-abstraction"
  }
}
